metric,value,threshold,pass,status,notes,last_updated
effective_poll_count,7.885100327699451,>= 6.0,True,ready,Minimum effective poll count for a publishable forecast.,2026-05-12
forecast_interval_width,21.916042516774798,<= 24.0,True,ready,Wide intervals imply lower reliability and can block publication.,2026-05-12
pollster_sensitivity_max_shift,0.04711500000000002,<= 0.10,True,ready,Probability should not swing too sharply when one pollster is removed.,2026-05-12
primary_poll_margin_abs_error,8.296895616815291,<= 6.0,False,fail,Historical analog error proxy from the March primary polling miss.,2026-05-12
historical_brier_score,,historical benchmark required,False,insufficient_history,Not enough comparable historical forecast runs are stored in-repo.,2026-05-12
historical_log_loss,,historical benchmark required,False,insufficient_history,Not enough comparable historical forecast runs are stored in-repo.,2026-05-12
historical_calibration_error,,historical benchmark required,False,insufficient_history,Not enough comparable historical forecast runs are stored in-repo.,2026-05-12
historical_interval_coverage,,historical benchmark required,False,insufficient_history,Not enough comparable historical forecast runs are stored in-repo.,2026-05-12
