source,pollster,sponsor,start_date,end_date,release_date,sample_size,population,paxton_pct,cornyn_pct,undecided_other_pct,partisan_or_internal,usable_in_model,source_url,notes,poll_midpoint,days_old,recency_weight,sample_weight,population_weight,partisan_weight,model_weight,explicit_two_candidate_paxton_share,last_updated
University of Houston Hobby School,University of Houston Hobby School,University of Houston,2026-01-20,2026-01-31,2026-02-09,550,LV,48,35.0,17.0,False,True,https://www.uh.edu/hobby/primary2026/senate.pdf,Pre-primary hypothetical runoff; March Hunt voters in Paxton-Cornyn matchup.,2026-01-25 12:00:00,97,0.14645927135455744,0.9574271077563381,1.0,1.0,0.14022407657709463,0.5783132530120482,2026-05-03
McLaughlin & Associates,McLaughlin & Associates,unknown,2026-02-01,2026-02-28,2026-03-01,600,LV,50,35.0,16.0,True,True,https://data.ddhq.io/polls/2026/03/01/McLaughlin-%26-Associates-Texas,"Second-choice/head-to-head table; sponsor unclear, downweighted.",2026-02-14 12:00:00,77,0.21763764082403103,1.0,1.0,0.7,0.15234634857682172,0.5882352941176471,2026-05-03
Texas Public Opinion Research March,Texas Public Opinion Research,Texas Public Opinion Research,2026-03-07,2026-03-08,2026-03-09,781,LV,48,31.0,21.0,False,True,https://jouster.blog/wp-content/uploads/2026/03/TX-SEN-Republican-primary-runoff-poll-Texas-Public-Opinion-Research-March-2026.pdf,Post-primary Hunt voters in runoff.,2026-03-07 12:00:00,56,0.3298769776932236,1.1409060726749887,1.0,1.0,0.3763586470858706,0.6075949367088608,2026-05-03
Change Research,Change Research,Change Research,2026-03-17,2026-03-19,2026-03-19,807,RV,49,31.0,20.0,False,True,https://changeresearch.com/wp-content/uploads/2026/03/Texas-Memo-_-March-2026.pdf,Table lists 49 Paxton / 31 Cornyn / 16 unsure for March Hunt voters; residual treated as other/no-vote.,2026-03-18 00:00:00,46,0.40212454001574466,1.1597413504743201,0.75,1.0,0.3497703428225434,0.6125,2026-05-03
Quantus Insights,Quantus Insights,Quantus Insights,2026-03-21,2026-03-23,2026-03-24,1218,LV,58,,,False,False,https://www.cbsnews.com/texas/news/cornyn-is-looking-to-congressman-hunt-and-president-trump-for-support-against-paxton/,"CBS report: nearly 58% of Hunt voters now backing Paxton; Cornyn/undecided not reported, so context only.",2026-03-22 00:00:00,42,0.43527528164806206,1.4247806848775006,1.0,1.0,0.0,,2026-05-03
Texas Public Opinion Research April,Texas Public Opinion Research,Texas Public Opinion Research,2026-04-06,2026-04-07,2026-04-17,1225,LV,45,32.0,24.0,False,True,https://www.keranews.org/elections-2026/2026-04-17/paxton-cornyn-poll-republican-primary-runoff-texas-senate-race,Latest direct Hunt-voter transfer reported by KERA/Spectrum.,2026-04-06 12:00:00,26,0.597554769985219,1.4288690166235205,1.0,1.0,0.8538274965674738,0.5844155844155844,2026-05-03
